Category,Occurrences,Suggested Action
Helpful,8,Maintain strengths in response clarity and usefulness
Poor Phrasing,5,Improve language generation templates for clarity
Off-topic,5,Improve contextual relevance of answers
Excellent Service,3,Encourage consistency in high-quality support
Thank You,3,Leverage positive signals for training data
Not Specific Enough,2,Provide more detailed and task-specific responses
Incorrect Answer,2,Improve intent recognition and response matching
Missing Knowledge,1,Expand knowledge base for common questions
Too Technical,1,Simplify technical language for general users
